{
  "$schema": "https://raw.githubusercontent.com/Jamaalx/ro-api-hub/main/public/catalog.schema.json",
  "name": "ro-api-hub",
  "description": "Catalogue of Romanian public- and private-sector APIs. Generated from the frontmatter of src/content/docs/apis/**.",
  "license": "CC-BY-4.0",
  "source": "https://github.com/Jamaalx/ro-api-hub",
  "site_url": null,
  "count": 128,
  "services": [
    {
      "slug": "aep-prezenta",
      "name": "AEP — Prezența la vot și rezultate",
      "category": "elections",
      "sector": "public",
      "institution": "Autoritatea Electorală Permanentă (AEP)",
      "status": "active",
      "auth": "none",
      "protocol": "static_files",
      "sandbox_available": false,
      "contract_required": false,
      "openapi_spec": false,
      "pricing": "free",
      "official_docs": "https://prezenta.roaep.ro/",
      "api_base_url": "https://prezenta.roaep.ro/",
      "api_base_url_note": null,
      "verified_at": "2026-05-27",
      "links_checked_at": "2026-09-24",
      "source_url": "https://github.com/Jamaalx/ro-api-hub/blob/main/src/content/docs/apis/public/elections/aep-prezenta.md",
      "page_url": null
    },
    {
      "slug": "alertacui-ro",
      "name": "alertacui.ro — Romanian Company Monitoring",
      "category": "aggregator",
      "sector": "aggregators",
      "institution": "alertacui.ro (commercial)",
      "status": "gated",
      "auth": "api_key",
      "protocol": "REST/JSON",
      "sandbox_available": false,
      "contract_required": true,
      "openapi_spec": false,
      "pricing": "subscription",
      "official_docs": "https://www.alertacui.ro/verificare-monitorizare-firme/en/api/",
      "api_base_url": "https://www.alertacui.ro/api/",
      "api_base_url_note": null,
      "verified_at": "2026-05-27",
      "links_checked_at": "2026-09-24",
      "source_url": "https://github.com/Jamaalx/ro-api-hub/blob/main/src/content/docs/apis/aggregators/alertacui-ro.md",
      "page_url": null
    },
    {
      "slug": "alpha-bank-ro-psd2",
      "name": "Alpha Bank Romania Open Banking (PSD2)",
      "category": "banks",
      "sector": "private",
      "institution": "Alpha Bank Romania S.A.",
      "status": "suspended",
      "auth": "oauth2",
      "protocol": "REST/JSON",
      "sandbox_available": true,
      "contract_required": true,
      "openapi_spec": true,
      "pricing": "free",
      "official_docs": "https://www.unicredit.ro/ro/institutional/banca/fuziune-AlphaBank.html",
      "api_base_url": null,
      "api_base_url_note": "unknown",
      "verified_at": "2026-05-27",
      "links_checked_at": null,
      "source_url": "https://github.com/Jamaalx/ro-api-hub/blob/main/src/content/docs/apis/private/banks/alpha-bank-ro-psd2.md",
      "page_url": null
    },
    {
      "slug": "anaf-bilant",
      "name": "ANAF Annual Financial Statements Web Service (bilanț)",
      "category": "fiscal",
      "sector": "public",
      "institution": "ANAF (Agenția Națională de Administrare Fiscală)",
      "status": "active",
      "auth": "none",
      "protocol": "REST/JSON",
      "sandbox_available": false,
      "contract_required": false,
      "openapi_spec": false,
      "pricing": "free",
      "official_docs": "https://static.anaf.ro/static/10/Anaf/Informatii_R/doc_WS_Bilant_V1.txt",
      "api_base_url": "https://webservicesp.anaf.ro/bilant",
      "api_base_url_note": null,
      "verified_at": "2026-10-18",
      "links_checked_at": null,
      "source_url": "https://github.com/Jamaalx/ro-api-hub/blob/main/src/content/docs/apis/public/fiscal/anaf-bilant.md",
      "page_url": null
    },
    {
      "slug": "anaf-cazier-fiscal",
      "name": "Cazier Fiscal (Fiscal Record)",
      "category": "fiscal",
      "sector": "public",
      "institution": "ANAF",
      "status": "gated",
      "auth": "qualified_cert",
      "protocol": "REST/XML",
      "sandbox_available": false,
      "contract_required": false,
      "openapi_spec": false,
      "pricing": "free",
      "official_docs": "https://www.anaf.ro/anaf/internet/ANAF/servicii_online/",
      "api_base_url": null,
      "api_base_url_note": "unknown (inter-institutional)",
      "verified_at": "2026-05-27",
      "links_checked_at": "2026-09-24",
      "source_url": "https://github.com/Jamaalx/ro-api-hub/blob/main/src/content/docs/apis/public/fiscal/anaf-cazier-fiscal.md",
      "page_url": null
    },
    {
      "slug": "anaf-efactura-prod",
      "name": "RO e-Factura — Production",
      "category": "fiscal",
      "sector": "public",
      "institution": "ANAF / Ministerul Finanțelor",
      "status": "active",
      "auth": "oauth2",
      "protocol": "REST/XML",
      "sandbox_available": true,
      "contract_required": false,
      "openapi_spec": "partial",
      "pricing": "mandatory",
      "official_docs": "https://mfinante.gov.ro/en/web/efactura/informatii-tehnice",
      "api_base_url": "https://api.anaf.ro/prod/FCTEL/rest",
      "api_base_url_note": null,
      "verified_at": "2026-05-27",
      "links_checked_at": "2026-09-24",
      "source_url": "https://github.com/Jamaalx/ro-api-hub/blob/main/src/content/docs/apis/public/fiscal/anaf-efactura-prod.md",
      "page_url": null
    },
    {
      "slug": "anaf-efactura-test",
      "name": "RO e-Factura — Sandbox (Test)",
      "category": "fiscal",
      "sector": "public",
      "institution": "ANAF / Ministerul Finanțelor",
      "status": "active",
      "auth": "oauth2",
      "protocol": "REST/XML",
      "sandbox_available": true,
      "contract_required": false,
      "openapi_spec": "partial",
      "pricing": "free",
      "official_docs": "https://mfinante.gov.ro/en/web/efactura/informatii-tehnice",
      "api_base_url": "https://api.anaf.ro/test/FCTEL/rest",
      "api_base_url_note": null,
      "verified_at": "2026-05-27",
      "links_checked_at": "2026-09-24",
      "source_url": "https://github.com/Jamaalx/ro-api-hub/blob/main/src/content/docs/apis/public/fiscal/anaf-efactura-test.md",
      "page_url": null
    },
    {
      "slug": "anaf-etransport",
      "name": "RO e-Transport",
      "category": "fiscal",
      "sector": "public",
      "institution": "ANAF / Ministerul Finanțelor",
      "status": "active",
      "auth": "oauth2",
      "protocol": "REST/XML",
      "sandbox_available": true,
      "contract_required": false,
      "openapi_spec": "partial",
      "pricing": "mandatory",
      "official_docs": "https://static.anaf.ro/static/10/Anaf/AsistentaContribuabili_r/Ghid_RO_e_Transport_2025.pdf",
      "api_base_url": null,
      "api_base_url_note": "https://api.anaf.ro/prod/ETRANSPORT/ws/v1",
      "verified_at": "2026-05-27",
      "links_checked_at": "2026-09-24",
      "source_url": "https://github.com/Jamaalx/ro-api-hub/blob/main/src/content/docs/apis/public/fiscal/anaf-etransport.md",
      "page_url": null
    },
    {
      "slug": "anaf-etva",
      "name": "RO e-TVA (Pre-filled VAT Returns)",
      "category": "fiscal",
      "sector": "public",
      "institution": "ANAF / Ministerul Finanțelor",
      "status": "active",
      "auth": "qualified_cert",
      "protocol": "REST/XML",
      "sandbox_available": false,
      "contract_required": false,
      "openapi_spec": false,
      "pricing": "free",
      "official_docs": "https://mfinante.gov.ro/en/web/efactura/",
      "api_base_url": "https://webserviced.anaf.ro/SPVWS2/rest",
      "api_base_url_note": null,
      "verified_at": "2026-05-27",
      "links_checked_at": "2026-09-24",
      "source_url": "https://github.com/Jamaalx/ro-api-hub/blob/main/src/content/docs/apis/public/fiscal/anaf-etva.md",
      "page_url": null
    },
    {
      "slug": "anaf-oauth2",
      "name": "ANAF OAuth2 Token Service (logincert)",
      "category": "fiscal",
      "sector": "public",
      "institution": "ANAF",
      "status": "active",
      "auth": "qualified_cert",
      "protocol": "OAuth2",
      "sandbox_available": false,
      "contract_required": false,
      "openapi_spec": false,
      "pricing": "free",
      "official_docs": "https://static.anaf.ro/static/10/Anaf/Informatii_R/API/Oauth_procedura_inregistrare_aplicatii_portal_ANAF.pdf",
      "api_base_url": "https://logincert.anaf.ro/anaf-oauth2/v1",
      "api_base_url_note": null,
      "verified_at": "2026-05-27",
      "links_checked_at": "2026-09-24",
      "source_url": "https://github.com/Jamaalx/ro-api-hub/blob/main/src/content/docs/apis/public/fiscal/anaf-oauth2.md",
      "page_url": null
    },
    {
      "slug": "anaf-saf-t",
      "name": "SAF-T (Standard Audit File for Tax) — Declaration D406",
      "category": "fiscal",
      "sector": "public",
      "institution": "ANAF (OECD SAF-T standard)",
      "status": "active",
      "auth": "qualified_cert",
      "protocol": "REST/XML",
      "sandbox_available": false,
      "contract_required": false,
      "openapi_spec": false,
      "pricing": "mandatory",
      "official_docs": "https://static.anaf.ro/static/10/Anaf/Informatii_R/saf_t.htm",
      "api_base_url": "https://webserviced.anaf.ro/SPVWS2/rest/upload",
      "api_base_url_note": null,
      "verified_at": "2026-05-27",
      "links_checked_at": "2026-09-24",
      "source_url": "https://github.com/Jamaalx/ro-api-hub/blob/main/src/content/docs/apis/public/fiscal/anaf-saf-t.md",
      "page_url": null
    },
    {
      "slug": "anaf-spv",
      "name": "Spațiul Privat Virtual (SPV) Web Service",
      "category": "fiscal",
      "sector": "public",
      "institution": "ANAF",
      "status": "active",
      "auth": "oauth2",
      "protocol": "REST/JSON+PDF",
      "sandbox_available": false,
      "contract_required": false,
      "openapi_spec": false,
      "pricing": "free",
      "official_docs": "https://github.com/MfpAnaf/ClientSPV",
      "api_base_url": "https://webserviced.anaf.ro/SPVWS2/rest",
      "api_base_url_note": null,
      "verified_at": "2026-05-27",
      "links_checked_at": "2026-09-24",